<?xml version="1.0" encoding="UTF-8"?>
<!-- Copyright DASSAULT SYSTEMES 2013 -->
<DropConfig xmlns="DS_DELMIAMFNConfiguration" xmlns:xsi="http://www.w3.org/2001/XMLSchema-instance" xsi:schemaLocation="DS_DELMIAMFNConfiguration ../xsd/DELWebMfgItemDefDropTypeConfig.xsd" Title="Allowed types in drop areas" Description="Sample configuration file delivered by DS.">
  <Body>
    <Type name="Part"/>
    <Type name="Product"/>
    <Type name="VPMReference"/>
    <Type name="Resource"/>
    <Type name="ResourceArea"/>
    <Type name="CreateAssembly"/>
    <Type name="CreateMaterial"/>
    <Type name="CreateKit"/>
    <Type name="Provide"/>
  </Body>
  <Main>
    <Type name="CreateAssembly"/>
    <Type name="CreateMaterial"/>
    <Type name="CreateKit"/>
    <Type name="Provide"/>
  </Main>
  <Alternate>
    <Type name="CreateAssembly"/>
  </Alternate>
  <Origin>
    <Type name="CreateAssembly"/>
  </Origin>
  <CapableResource>
    <Type name="VPMReference"/>
  </CapableResource>
</DropConfig>
